{
  "set_id": "mini-v1",
  "kind": "demonstration",
  "title": "Synthetic fixture for metric arithmetic",
  "labelling": { "labellers": ["fixture"], "independent": false, "authored_the_prompts": true },
  "manuscript": { "name": "mini.pdf", "synthetic": true },
  "sources": [
    { "slug": "a-2020", "label": "1", "expected_ref_status": "retrieved" },
    { "slug": "b-2021", "label": "2", "expected_ref_status": "retrieved" },
    { "slug": "c-2022", "label": "3", "expected_ref_status": "paywalled" }
  ],
  "coverage_gold": { "labels_in_text": ["1", "2", "3", "4"] },
  "uncited_gold": [{ "text": "An assertion with no citation at all.", "location": "Intro" }],
  "cases": [
    {
      "case_id": "m-c01",
      "claim_text": "The reported AUC was 0.91.",
      "citation_labels": ["1"],
      "gold_verdict": "supported",
      "gold_source_slug": "a-2020", "gold_source_page": 2,
      "decisive_passage": "an AUC of 0.91 in the held-out set",
      "gold_anchor_phrases": ["0.91"],
      "why": "Stated verbatim.",
      "pair": { "pair_id": "p1", "role": "faithful", "alteration": "none" }
    },
    {
      "case_id": "m-c02",
      "claim_text": "The reported AUC was 0.99.",
      "citation_labels": ["1"],
      "gold_verdict": "contradicted",
      "gold_source_slug": "a-2020", "gold_source_page": 2,
      "decisive_passage": "an AUC of 0.91 in the held-out set",
      "gold_anchor_phrases": ["0.91"],
      "why": "The source says 0.91.",
      "match_keys": { "must_contain_any": ["0.99"] },
      "pair": { "pair_id": "p1", "role": "altered", "derived_from": "m-c01",
                "alteration": "numeric_substitution" }
    },
    {
      "case_id": "m-c03",
      "claim_text": "The method was validated in children.",
      "citation_labels": ["2"],
      "gold_verdict": "partial",
      "gold_source_slug": "b-2021", "gold_source_page": 5,
      "decisive_passage": "validated in an adult cohort aged 18 and over",
      "gold_anchor_phrases": ["adult cohort"],
      "why": "Validation happened, but in adults, not children."
    },
    {
      "case_id": "m-c04",
      "claim_text": "Prevalence is rising worldwide.",
      "citation_labels": ["3"],
      "gold_verdict": "not_retrieved",
      "gold_source_slug": null, "gold_source_page": null,
      "decisive_passage": null, "gold_anchor_phrases": [],
      "expected_unavailability": "paywalled",
      "why": "No open-access copy; declining is correct."
    },
    {
      "case_id": "m-c05",
      "claim_text": "A claim nobody extracted.",
      "citation_labels": ["4"],
      "gold_verdict": "supported",
      "gold_source_slug": "b-2021", "gold_source_page": 7,
      "decisive_passage": "the missing statement",
      "gold_anchor_phrases": ["missing statement"],
      "why": "Present in the source; extraction should have caught it."
    },
    {
      "case_id": "m-c06",
      "claim_text": "An ambiguous claim about the cohort.",
      "citation_labels": ["2"],
      "gold_verdict": null,
      "gold_source_slug": "b-2021", "gold_source_page": 5,
      "decisive_passage": "ambiguous wording",
      "gold_anchor_phrases": ["ambiguous"],
      "ambiguity": "unresolved",
      "why": "Labellers could not agree; kept, excluded from every denominator."
    }
  ]
}
